{
  "id": "US",
  "name": "YaaS United States Market",
  "description": "SAP-Hybris YaaS Market United States of America",
  "_link_": "https://api.eu.yaas.io/hybris/ypi/v1/markets/US",
  "url": "https://market.yaas.io/us",
  "locale": {
    "languages": [
      "en",
      "de"
    ],
    "official": "en-US",
    "default": "en"
  },
  "timezone": {
    "name": "America/New_York",
    "_link_": "https://api.eu.yaas.io/hybris/ypi/v1/timezone/America/New_York"
  },
  "region": {
    "_link_": "https://api.eu.yaas.io/hybris/ypi/v1/regions/US",
    "id": "US"
  },
  "billing": {
    "currency": "USD",
    "pricing": "usPriceGroup",
    "vendor": "sapamerica"
  },
  "links": {
    "impressum": "https://go.sap.com/about/legal/impressum.html",
    "copyright": "https://go.sap.com/about/legal/copyright.html",
    "privacy": "https://go.sap.com/about/legal/privacy.html",
    "terms": "https://www.yaas.io/legal/sap-hybris-as-a-service-account-terms-of-use_v2.html",
    "contract": "https://www.yaas.io/legal/sap-hybris-as-a-service-organization-terms-of-use_v1.html",
    "agreement_terms": "https://www.yaas.io/legal/SAP_Hybris_as_a_Service_Terms-of-use_usEN_v10-2016.pdf",
    "api": "https://api.us.yaas.io"
  }
}